Simple	English	semantic-similarity
Fibromyalgia is a condition with chronic pain . The exact causes are not known. However, symptoms are not totally restricted to the pain. There are also sleep disturbances, joint stiffness and severe fatigue. The problem sometimes exists along with depression , stress and anxiety . Fibromyalgia affects mostly women, though men can also be affected. Adults are usually the victims, although children may also be affected.  symptoms- widespread pain,if you have fibromyalgia,one of the main symptoms is most likely to be widespread pain... Extreme sensitivity... Stiffness... fatigue... poor sleep quality... congnitive prombles 	Fibromyalgia  is a medical condition characterized by chronic widespread pain and a heightened pain response to pressure .  Other symptoms include tiredness to a degree that normal activities are affected, sleep problems and troubles with memory .  Some people also report restless legs syndrome , bowel or bladder problems , numbness and tingling and sensitivity to noise, lights or temperature.  Fibromyalgia is frequently associated with depression , anxiety and posttraumatic stress disorder .  Other types of chronic pain are also frequently present.  The cause of fibromyalgia is unknown; however, it is believed to involve a combination of genetic and environmental factors.   The condition runs in families and many genes are believed to be involved.  Environmental factors may include psychological stress , trauma , and certain infections .  The pain appears to result from processes in the central nervous system and the condition is referred to as a "central sensitization syndrome".   Fibromyalgia is recognized as a disorder in both the U.S. by the US National Institutes of Health and the American College of Rheumatology ,   and in Canada by the Canadian Rheumatology Association and the Canadian Pain Society.  There is no specific diagnostic test,  although as of 2020, several diagnostic blood tests were in the process of moving towards certification and wider use for diagnosing fibromyalgia in conjunction with a physical examination.   Nonetheless, all forms of diagnosis involve first ruling out other potential causes and verifying that a set number of symptoms are present.  	3.1209457
In medicine the term comorbidity is used to describe diseases and conditions that often occur together with another disease or condition. The first disease or disorder is called primary . In many cases, the primary condition or disease does not cause the comorbid disorders. However, they may both be caused or partly caused by the same thing, for example a genetic mutation or a traumatic experience. As an example, a patient may have antisocial personality disorder and attention-deficit hyperactivity disorder . The two conditions are comorbid . Another patient might suffer from borderline personality disorder , posttraumatic stress disorder and bipolar disorder . The three conditions are comorbid .	In medicine , comorbidity is the presence of one or more additional conditions often co-occurring  with a primary condition. Comorbidity describes the effect of all other conditions an individual patient might have other than the primary condition of interest, and can be physiological or psychological. In the context of mental health, comorbidity often refers to disorders that are often coexistent with each other, such as depression and anxiety disorders. Comorbidity can indicate either a condition existing simultaneously, but independently with another condition or a related medical condition. The latter sense of the term causes some overlap with the concept of complications . For example, in longstanding diabetes mellitus , the extent to which coronary artery disease is an independent comorbidity versus a diabetic complication is not easy to measure, because both diseases are quite multivariate and there are likely aspects of both simultaneity and consequence. The same is true of intercurrent diseases in pregnancy . In other examples, the true independence or relation is not ascertainable because syndromes and associations are often identified long before pathogenetic commonalities are confirmed . In psychiatric diagnoses it has been argued in part that this "'use of imprecise language may lead to correspondingly imprecise thinking',  this usage of the term 'comorbidity' should probably be avoided."  However, in many medical examples, such as comorbid diabetes mellitus and coronary artery disease, it makes little difference which word is used, as long as the medical complexity is duly recognized and addressed. Many tests attempt to standardize the "weight" or value of comorbid conditions, whether they are secondary or tertiary illnesses. Each test attempts to consolidate each individual comorbid condition into a single, predictive variable that measures mortality or other outcomes. Researchers have validated such tests because of their predictive value, but no one test is as yet recognized as a  standard.	3.1203187
In medicine the term comorbidity is used to describe diseases and conditions that often occur together with another disease or condition. The first disease or disorder is called primary . In many cases, the primary condition or disease does not cause the comorbid disorders. However, they may both be caused or partly caused by the same thing, for example a genetic mutation or a traumatic experience. As an example, a patient may have antisocial personality disorder and attention-deficit hyperactivity disorder . The two conditions are comorbid . Another patient might suffer from borderline personality disorder , posttraumatic stress disorder and bipolar disorder . The three conditions are comorbid .	In medicine , comorbidity is the presence of one or more additional conditions often co-occurring  with a primary condition. Comorbidity describes the effect of all other conditions an individual patient might have other than the primary condition of interest, and can be physiological or psychological. In the context of mental health, comorbidity often refers to disorders that are often coexistent with each other, such as depression and anxiety disorders. Comorbidity can indicate either a condition existing simultaneously, but independently with another condition or a related medical condition. The latter sense of the term causes some overlap with the concept of complications . For example, in longstanding diabetes mellitus , the extent to which coronary artery disease is an independent comorbidity versus a diabetic complication is not easy to measure, because both diseases are quite multivariate and there are likely aspects of both simultaneity and consequence. The same is true of intercurrent diseases in pregnancy . In other examples, the true independence or relation is not ascertainable because syndromes and associations are often identified long before pathogenetic commonalities are confirmed . In psychiatric diagnoses it has been argued in part that this "'use of imprecise language may lead to correspondingly imprecise thinking',  this usage of the term 'comorbidity' should probably be avoided."  However, in many medical examples, such as comorbid diabetes mellitus and coronary artery disease, it makes little difference which word is used, as long as the medical complexity is duly recognized and addressed. Many tests attempt to standardize the "weight" or value of comorbid conditions, whether they are secondary or tertiary illnesses. Each test attempts to consolidate each individual comorbid condition into a single, predictive variable that measures mortality or other outcomes. Researchers have validated such tests because of their predictive value, but no one test is as yet recognized as a  standard.	3.1203187
Ayurveda   is an alternative medicine system from the Indian subcontinent .  Ayurveda is .    The Indian Medical Association  says the practice of modern medicine by Ayurveda is quackery .  Ayurvedic texts say that the gods of Hindu mythology gave medical knowledge to legendary Hindu philosophers , who then gave the knowledge to human physicians .  The word "ayurveda" is from the Sanskrit : आयुर्वेद , Āyurveda , and means knowledge of life and longevity .  In Ayurveda, the story is that Dhanvantari , the Hindu god of Ayurveda, made himself into a human king by incarnation . He was king of Varanasi , and taught Ayurvedic medicine to a group of physicians. One of these physicians, named Sushruta, wrote the Sushruta Samhita , an Ayurvedic text that has this story in it.   Most Ayurvedic therapies are made from chemical compounds taken from plants, from minerals , and from metals . In ancient India , Ayurvedic texts gave explanations for surgeries and for the stitching of wounds to help wound healing . The ancient Indians knew how to take out kidney stones and how to do rhinoplasty .   People have used many different Ayurvedic therapies through the history of India . Ayurveda has changed for more than two thousand years.  In the 1970s and 1980s, Ayurveda also changed for consumption in the Western world . Some people say Ayurveda comes from Prehistory .   Some ideas in Ayurveda may have been in existence at the time of the Indus Valley civilization , during the Bronze Age in India.  During the Vedic period , Ayurveda went through many developments. Outside the tradition of the Vedas , Buddhism and Jainism also shared some ideas with the Ayurvedic texts from ancient India.  By around two thousand years ago, Ayurveda had developed some of its ideas for surgery and drugs .  There is no good evidence that works or helps for any disease .  Some Ayurvedic products have lead , mercury , and arsenic in them.  In 2008, nearly 21% of Ayurvedic products sold on the internet and made in India and the United States had in them lead , mercury , and arsenic  in quantities that are toxic .  There may be public health dangers that result from this, but that is not known. 	Ayurveda   is an alternative medicine system with historical roots in the Indian subcontinent.  The theory and practice of Ayurveda is pseudoscientific .    The Indian Medical Association  characterises the practice of medicine by Ayurvedic practitioners as quackery .  Ayurveda is heavily practiced in India and Nepal, where around 80% of the population report using it.     Ayurveda therapies have varied and evolved over more than two millennia.  Therapies include medicines, special diets, meditation, yoga, massage, laxatives, enemas, and medical oils.   Medicines are typically based on complex herbal compounds, minerals, and metal substances . Ancient Ayurveda texts also taught surgical techniques, including rhinoplasty , kidney stone extractions , sutures, and the extraction of foreign objects.  	3.1159906
Glasgow Coma Scale or GCS is a scale that is used to measure the consciousness of a person. It was invented in 1974 by Graham Teasdale and Bryan J. Jennett , professors of neurosurgery at the University of Glasgow. GCS is used in evaluation of patients, especially in ICUs . This scale consists of three tests, which are described below. A score is given for each test, and the GCS score is calculated by adding the scores given to each test. The maximum score is 15, which means the patient is fully conscious. The minimum score is 3, and is usually seen in patients with brain death or those in deep coma . The scale comprises three tests: eye , verbal  and motor  responses. There are 4 grades for this test:	The Glasgow Coma Scale   is a clinical scale used to reliably measure a person's level of consciousness after a brain injury . The GCS assesses a person based on their ability to perform eye movements, speak, and move their body. These three behaviors make up the three elements of the scale: eye, verbal, and motor. A person's GCS score can range from 3  to 15 . This score is used to guide immediate medical care after a brain injury  and also to monitor hospitalized patients and track their level of consciousness. Lower GCS scores are correlated with higher risk of death. However, the GCS score alone should not be used on its own to predict the outcome for an individual person with brain injury.	3.1103399
The term flat feet  is a medical condition in which human foot arches are very low or the entire sole of the human foot is touching the ground. Flat feet in children may become regular arches later on.  Adults with this condition may have problems involving arch development. The opposite, less common condition is called high arch .	Flat feet  is a postural deformity in which the arches of the foot collapse, with the entire sole of the foot coming into complete or near-complete contact with the ground. There is a functional relationship between the structure of the arch of the foot and the biomechanics of the lower leg. The arch provides an elastic, springy connection between the forefoot and the hind foot so that a majority of the forces incurred during weight bearing on the foot can be dissipated before the force reaches the long bones of the leg and thigh.  In pes planus, the head of the talus bone is displaced medially and distal from the navicular bone . As a result, the Plantar calcaneonavicular ligament  and the tendon of the tibialis posterior muscle are stretched to the extent that the individual with pes planus loses the function of the medial longitudinal arch . If the MLA is absent or nonfunctional in both the seated and standing positions, the individual has “rigid” flatfoot. If the MLA is present and functional while the individual is sitting or standing up on their toes, but this arch disappears when assuming a foot-flat stance, the individual has “supple” flatfoot. This latter condition is often treated with arch supports.  However, a recent randomized controlled trial found no evidence for the efficacy of treatment of flat feet in children either from expensive prescribed orthotics  or less expensive over-the-counter orthotics.  Three studies  of military recruits have shown no evidence of increased injury, or foot problems, due to flat feet, in a population of people who reach military service age without prior foot problems. However, these studies cannot be used to judge possible future damage from this condition when diagnosed at younger ages. They also cannot be applied to persons whose flat feet are associated with foot symptoms, or certain symptoms in other parts of the body  possibly referable to the foot.	3.1098318
Cyclophosphamide is a drug used in the treatment of lymphoma, some types of leukemia , and some solid cancers, as well as for some forms of Nephritis , Rheumatoid arthritis , and multiple sclerosis .	Cyclophosphamide , also known as cytophosphane among other names,  is a medication used as chemotherapy and to suppress the immune system .  As chemotherapy it is used to treat lymphoma , multiple myeloma , leukemia , ovarian cancer , breast cancer , small cell lung cancer , neuroblastoma , and sarcoma .  As an immune suppressor it is used in nephrotic syndrome , granulomatosis with polyangiitis , and following organ transplant , among other conditions.   It is taken by mouth or injection into a vein .  Most people develop side effects.  Common side effects include low white blood cell counts , loss of appetite, vomiting, hair loss , and bleeding from the bladder .  Other severe side effects include an increased future risk of cancer, infertility , allergic reactions , and pulmonary fibrosis .  Cyclophosphamide is in the alkylating agent and nitrogen mustard family of medications.  It is believed to work by interfering with the duplication of DNA and the creation of RNA .  Cyclophosphamide was approved for medical use in the United States in 1959.  It is on the World Health Organization's List of Essential Medicines . 	3.1074524
The 501Y.V2 variant , also known as South African COVID-19 variant , is a variant of the SARS-CoV-2 , the virus that causes COVID-19 . It is one of several SARS-CoV-2 variants. It was first detected in the Nelson Mandela Bay  metropolitan area of the Eastern Cape province of South Africa . On 23 December 2020, the United Kingdom health minister Matt Hancock said that two people who had travelled from South Africa to the United Kingdom were infected with the 501.V2.  On 28 December, the variant was detected in two people in Switzerland  and one in Finland .  The United States reported its first cases of the variant in the U.S. state of South Carolina . 	Lineage B.1.351  is a variant of SARS-CoV-2 , the virus that causes COVID-19 . One of several SARS-CoV-2 variants believed to be of particular importance , it was first detected in the Nelson Mandela Bay  metropolitan area of the Eastern Cape province of South Africa in October 2020,  which was reported by the country's health department on 18 December 2020.  Phylogeographic analysis suggests this variant emerged in the Nelson Mandela Bay already in July or August 2020.  A genomics team lead by the KwaZulu-Natal Research Innovation and Sequencing Platform  at the University of KwaZulu-Natal discovered the new variant.  It was uncovered by whole genome sequencing . Several genomic sequences from this lineage were submitted to the GISAID sequence database.  	3.1072788
The 501Y.V2 variant , also known as South African COVID-19 variant , is a variant of the SARS-CoV-2 , the virus that causes COVID-19 . It is one of several SARS-CoV-2 variants. It was first detected in the Nelson Mandela Bay  metropolitan area of the Eastern Cape province of South Africa . On 23 December 2020, the United Kingdom health minister Matt Hancock said that two people who had travelled from South Africa to the United Kingdom were infected with the 501.V2.  On 28 December, the variant was detected in two people in Switzerland  and one in Finland .  The United States reported its first cases of the variant in the U.S. state of South Carolina . 	Lineage B.1.351  is a variant of SARS-CoV-2 , the virus that causes COVID-19 . One of several SARS-CoV-2 variants believed to be of particular importance , it was first detected in the Nelson Mandela Bay  metropolitan area of the Eastern Cape province of South Africa in October 2020,  which was reported by the country's health department on 18 December 2020.  Phylogeographic analysis suggests this variant emerged in the Nelson Mandela Bay already in July or August 2020.  A genomics team lead by the KwaZulu-Natal Research Innovation and Sequencing Platform  at the University of KwaZulu-Natal discovered the new variant.  It was uncovered by whole genome sequencing . Several genomic sequences from this lineage were submitted to the GISAID sequence database.  	3.1072788
Somnolence  is a strong desire for sleep . It is also sleeping for unusually long periods. It can refer to the usual state before falling asleep. It can be accompanied by lethargy , weakness and difficulty thinking.  Sleepiness can be dangerous when performing tasks that require constant concentration, such as driving a vehicle .	Somnolence  is a state of strong desire for sleep , or sleeping for unusually long periods . It has distinct meanings and causes. It can refer to the usual state preceding falling asleep ,  the condition of being in a drowsy state due to circadian rhythm disorders, or a symptom of other health problems. It can be accompanied by lethargy , weakness, and lack of mental agility.  Somnolence is often viewed as a symptom rather than a disorder by itself. However, the concept of somnolence recurring at certain times for certain reasons constitutes various disorders, such as excessive daytime sleepiness , shift work sleep disorder , and others; and there are medical codes for somnolence as viewed as a disorder. Sleepiness can be dangerous when performing tasks that require constant concentration, such as driving a vehicle. When a person is sufficiently fatigued , microsleeps may be experienced. In individuals deprived of sleep, somnolence may spontaneously dissipate for short periods of time; this phenomenon is the second wind , and results from the normal cycling of the circadian rhythm interfering with the processes the body carries out to prepare itself to rest.	3.1069608
Dilation and Curettage  is a type of surgery used to diagnose and treat problems with woman's uterus . During a D&C, a doctor will do these things:  A D&C can be used for many reasons.  For example: 	Dilation  and curettage  refers to the dilation  of the cervix and surgical removal of part of the lining of the uterus and/or contents of the uterus by scraping and scooping . It is a gynecologic procedure used for diagnostic and therapeutic purposes, and is the most commonly used method for first trimester miscarriage or abortion .     D&C normally refers to a procedure involving a curette , also called sharp curettage .  However, some sources use the term D&C to refer to any procedure that involves the processes of dilation and removal of uterine contents, which includes the more common suction curettage procedures of manual and electric vacuum aspiration .  D&Cs may be performed in pregnant and non-pregnant patients, for different clinical indications.	3.1066134
Amyloidosis is a rare and serious disease that could be fatal that is caused by accumulation of proteins in the form of abnormal, insoluble fibres, known as amyloid fibrils, within the tissues of the body.   Amyloid deposits can be confined to only one part of the body or a single organ system in 'local amyloidosis' or they can be widely distributed in organs and tissues throughout the body in 'systemic amyloidosis'. The symptoms of amyloidosis are accordingly highly variable and confirmation of the presence of amyloid in the tissues can be challenging, so that diagnosis is often delayed. There are many different types of amyloidosis, each caused by formation of amyloid fibrils from different soluble precursor proteins in different patients.   About 30 different proteins are known to form amyloid fibrils in humans  and amyloidosis is named and classified according to the identity of the respective fibril protein.  Though this disease being rare, many famous people have died from this disease such as: Martin McGuinness , David Lange , Robert Jordan and Robert P. Casey .	Amyloidosis is a group of diseases in which abnormal proteins , known as amyloid fibrils , build up in tissue.  There are several types with varying symptoms; signs and symptoms may include diarrhea , weight loss, feeling tired, enlargement of the tongue, bleeding, numbness, feeling faint with standing , swelling of the legs, or enlargement of the spleen.  There are about 30 different types of amyloidosis, each due to a specific protein misfolding .  Some are genetic while others are acquired.  They are grouped into localized forms , and systemic ones.  The four most common types of systemic amyloidosis are light chain  , inflammation , dialysis-related , and hereditary and old age .  Diagnosis may be suspected when protein is found in the urine , organ enlargement is present, or problems are found with multiple peripheral nerves and it is unclear why.  Diagnosis is confirmed by tissue biopsy .  Due to the variable presentation, a diagnosis can often take some time to reach. 	3.1057322
