Simple	English	semantic-similarity
Excessive daytime sleepiness  is a medical condition where people often feel sleepy during the day, even though they had enough sleep at night. EDS occurs with many sleep disorders . It is a defining feature of some sleep disorders such as narcolepsy , sleep apnea or Circadian rhythm sleep disorder . EDS is difficult to treat without knowing its causse. There are certain drugs that can help with EDS. In general, many treatments of the underlying disease  will also take into account EDS. The drugs which can treat EDS are usually stimulants .	Excessive daytime sleepiness is characterized by persistent sleepiness and often a general lack of energy, even during the day after apparently adequate or even prolonged nighttime sleep. EDS can be considered as a broad condition encompassing several sleep disorders where increased sleep is a symptom, or as a symptom of another underlying disorder like narcolepsy , circadian rhythm sleep disorder , sleep apnea or idiopathic hypersomnia . Some persons with EDS, including those with hypersomnias like narcolepsy and idiopathic hypersomnia , are compelled to nap repeatedly during the day; fighting off increasingly strong urges to sleep during inappropriate times such as while driving, while at work, during a meal, or in conversations. As the compulsion to sleep intensifies, the ability to complete tasks sharply diminishes, often mimicking the appearance of intoxication. During occasional unique and/or stimulating circumstances, a person with EDS can sometimes remain animated, awake and alert, for brief or extended periods of time.  EDS can affect the ability to function in family, social, occupational, or other settings. A proper diagnosis of the underlying cause and ultimately treatment of symptoms and/or the underlying cause can help mitigate such complications.  EDS can be a symptom of a number of factors and disorders. Specialists in sleep medicine are trained to diagnose them. Some are:	3.3550324
A central venous catheter  or " central line " is a catheter put in a large vein in the neck , chest , or groin when a patient needs close cardiovascular monitoring, for assessment of fluid status, and so that intravenous drugs and fluids can be given to the patient more effectively.  The veins most commonly used are the internal jugular vein , the subclavian vein , and the femoral vein .	A central venous catheter , also known as a central line , central venous line, or central venous access catheter , is a catheter placed into a large vein . It is a form of venous access . Placement of larger catheters in more centrally located veins is often needed in critically ill patients, or in those requiring prolonged intravenous therapies, for more reliable vascular access. These catheters are commonly placed in veins in the neck , chest , groin , or through veins in the arms .	3.354905
Chronic inflammatory demyelinating polyneuropathy  is an immune-mediated inflammatory disorder of the peripheral nervous system . The disorder is sometimes called chronic relapsing polyneuropathy  or chronic inflammatory demyelinating poly radiculo neuropathy . CIDP is closely related to Guillain–Barré syndrome and it is thought to be the chronic counterpart of that acute disease.  Its symptoms are also similar to progressive inflammatory neuropathy . Several variants have been reported. Specially important are:	Chronic inflammatory demyelinating polyneuropathy is an acquired immune-mediated inflammatory disorder of the peripheral nervous system characterized by progressive weakness and impaired sensory function in the legs and arms.  The disorder is sometimes called chronic relapsing polyneuropathy  or chronic inflammatory demyelinating poly radiculo neuropathy .  CIDP is closely related to Guillain–Barré syndrome and it is considered the chronic counterpart of that acute disease.  Its symptoms are also similar to progressive inflammatory neuropathy . Several variants have been reported. Specially important are: Currently there is one special variant in which the CNS is also affected. It is termed "combined central and peripheral demyelination"  and is special because it belongs at the same time to the CDIP syndrome and to the multiple sclerosis spectrum.  These cases seem to be related to the presence of anti-neurofascin autoantibodies . 	3.3416116
Bevacizumab is an anti-angiogenic drug that is used in the treatment of Metastatic Renal cell carcinoma , Metastatic breast cancer , Non-small cell lung cancer , and is also approved in the treatment Glioblastoma multiforme . 	Bevacizumab , sold under the brand name Avastin , is a medication used to treat a number of types of cancers and a specific eye disease .   For cancer, it is given by slow injection into a vein  and used for colon cancer , lung cancer , glioblastoma , and renal-cell carcinoma . In many of these diseases it is used as a first-line therapy   For age-related macular degeneration it is given by injection into the eye .  Common side effects when used for cancer include nose bleeds , headache, high blood pressure, and rash.  Other severe side effects include gastrointestinal perforation , bleeding, allergic reactions , blood clots , and an increased risk of infection.  When used for eye disease side effects can include vision loss and retinal detachment .  Bevacizumab is a monoclonal antibody that functions as an angiogenesis inhibitor .  It works by slowing the growth of new blood vessels by inhibiting vascular endothelial growth factor A , in other words anti–VEGF therapy . 	3.333475
The Hôpital Foch is a well-known hospital in the Suresnes , close to Paris . It is one of Europe's largest hospitals. It has been created in 1929. He is partner of the Université de Versailles Saint-Quentin-en-Yvelines . 	Foch Hospital  is a celebrated teaching hospital in the Suresnes , France . Part of the Établissement de santé privé d'intérêt collectif and a teaching hospital of Versailles Saint-Quentin-en-Yvelines University ,  it is one of Europe's largest hospitals. It was established in 1929 with the help of Consuelo Vanderbilt  and Winnaretta Singer . It was named in honour of Ferdinand Foch . Through its history, the Foch Hospital hosted notable doctors, among others:	3.3277223
Bacillus Calmette–Guerin is a vaccine against tuberculosis . It is often abbreviated BCG . The vaccine is based on a bovine strain of the bacterium . It was developed by Albert Calmette and Camille Guerin in the 1930s. It looks like the vaccine can also be used to treat certain forms of bladder cancer . 	Bacillus Calmette–Guérin  vaccine is a vaccine primarily used against tuberculosis .  It is named after its inventors Albert Calmette and Camille Guérin .   In countries where TB or leprosy is common, one dose is recommended in healthy babies as soon after birth as possible.  In areas where TB is not common, only children at high risk are typically immunized, while suspected cases of TB are individually tested for and treated.  Adults who do not have TB and have not been previously immunized but are frequently exposed may be immunized as well.  BCG also has some effectiveness against Buruli ulcer infection and other nontuberculous mycobacteria infections.  Additionally it is sometimes used as part of the treatment of bladder cancer .   Rates of protection against TB infection vary widely and protection lasts up to twenty years.  Among children it prevents about 20% from getting infected and among those who do get infected it protects half from developing disease.  The vaccine is given by injection into the skin.  There is no evidence that additional doses are beneficial. 	3.3255823
Retching  is when the motion of the stomach and esophagus goes backward, but there is no vomiting . It can be caused by bad smells, choking or stopping certain medications . It can also be because of stress . Retching is different from vomiting. During a retch, pressure in the thorax goes down and pressure in the abdomen goes up. In vomiting, both pressures go up.	Retching  is the reverse movement  of the stomach and esophagus without vomiting .  It can be caused by bad smells or choking, or by withdrawal from some medications after vomiting stops. Retching can also occur as a result of an emotional response or from stress , which produces the same physical reaction. The function is thought to be mixing gastric contents with intestinal refluxate in order to buffer the former and give it momentum in preparation of vomiting.  Treatments include medication and correction of the fluid and electrolyte balance . The retching phase is characterized by a series of violent spasmodic abdomino - thoracic contractions with the glottis closed. During this time, the inspiratory  movements of the chest wall and diaphragm are opposed by the expiratory contractions of the abdominal musculature. At the same time, movements of the stomach and its contents take place. Whereas a patient will complain of disagreeable sensations during nausea , speech is not possible during retching. The characteristic movements furnish a ready diagnostic sign of the retching phase. Schindler   studied retching on two occasions during gastroscopy and noted that longitudinal folds appeared in the previously smooth antrum , thickened quickly, came together and completely closed the antrum.  Retching involves a deep inspiration against a closed glottis . This, along with contraction of the abdomen, leads to a pressure difference between the abdominal and thoracic cavities. As a result, the stomach and gastric contents are displaced upwards toward the thoracic cavity.  Retching comprises a rhythmically alternating  elevation and descension of the entire pharyngolaryngo-esophago-gastric apparatus in synchrony with the movement of the diaphragm. The function of retching may be to mix gastric contents with intestinal refluxate to buffer gastric contents before gastroesophageal reflux and to impart a momentum to the gastric contents before vomiting. Airway protection during retching is accomplished by glottal closure during retches and constriction of the upper esophageal sphincter between retches. 	3.3254306
Bloodletting is the practice  of withdrawing blood from a patient to cure a disease . The practice was widely used in Antiquity and the Middle Ages . People stopped using it in the 19th century . The idea of bloodletting comes from an ancient system of medicine called Humorism : This system states, that there are different humors in the body. To remain healthy, a patient had to keep these humours in balance. Bloodletting was the most common medical practice performed by physicians from antiquity until the late 19th century, a span of almost 2,000 years.  It was found that only in very few cases, this treatment helps cure a disease. The practice has now been abandoned for all except a few very specific conditions .  There was no other treatment for hypertension . Bloodletting could sometimes have had a beneficial effect in temporarily reducing blood pressure by reducing blood volume.  The problem with hypertension is that it is difficult to diagonse from its symptoms . Modern methods directly measure blood pressure. In Antiquity, this  effect was therefore unintentional. In most cases, the historical use of bloodletting was harmful to patients.  The diseases where bloodletting actually helps include Polycythemia vera . In this disease, the number of red blood cells is increased, which changes the viscosity of the blood. Another disease is Polycythemia , which also leads to an increased number of red blood cells.	Bloodletting  is the withdrawal of blood from a patient to prevent or cure illness and disease.  Bloodletting, whether by a physician or by leeches , was based on an ancient system of medicine in which blood and other bodily fluids were regarded as " humours " that had to remain in proper balance to maintain health. It is claimed to have been the most common medical practice performed by surgeons from antiquity until the late 19th century, a span of over 2,000 years.  In Europe, the practice continued to be relatively common until the end of the 18th century.  The practice has now been abandoned by modern-style medicine for all except a few very specific medical conditions .  It is conceivable that historically, in the absence of other treatments for hypertension , bloodletting sometimes had a beneficial effect in temporarily reducing blood pressure by reducing blood volume.  However, since hypertension is very often asymptomatic and thus not diagnosable without modern methods, this effect was unintentional.  In the overwhelming majority of cases, the historical use of bloodletting was harmful to patients.  Today, the term phlebotomy refers to the drawing of blood for laboratory analysis or blood transfusion .  Therapeutic phlebotomy refers to the drawing of a unit of blood in specific cases like hemochromatosis , polycythemia vera , porphyria cutanea tarda , etc., to reduce the number of red blood cells.   The traditional medical practice of bloodletting is today considered to be a pseudoscience .  Passages from the Ebers  Papyrus may indicate that bloodletting by scarification  was an accepted practice in Ancient Egypt .    Egyptian burials have been reported to contain bloodletting instruments.  According to some accounts, the Egyptians based the idea on their observations of the hippopotamus ,  confusing its red secretions with blood and believing that it scratched itself to relieve distress.  	3.3085694
The British Medical Journal  is a popular peer-reviewed general medical journal. It is published by the BMJ Publishing Group in London . There is an online version.	The BMJ is a weekly peer-reviewed medical trade journal , published by the trade union the British Medical Association . The BMJ has editorial freedom from the BMA.  It is one of the world's oldest general medical journals. Originally called the British Medical Journal , the title was officially shortened to BMJ in 1988, and then changed to The BMJ in 2014.  The journal is published by BMJ Publishing Group Ltd , a subsidiary of the British Medical Association . The editor-in-chief of The BMJ is Fiona Godlee , who was appointed in February 2005.  The journal began publishing on 3 October 1840 as the Provincial Medical and Surgical Journal and quickly attracted the attention of physicians around the world through its publication of high-impact original research articles and unique case reports.  The BMJ' s first editors were P. Hennis Green , lecturer on the diseases of children at the Hunterian School of Medicine , who also was its founder and Robert Streeten of Worcester , a member of the Provincial Medical and Surgical Association council. 	3.3013365
An Elizabethan collar , also called a, e-collar , lampshade or cone of shame is a piece of equipment used in veterinary medicine .  They stop the animal from licking or biting its body and from scratching or touching its head with its feet.  The veterinarian places the collar around the neck of an injured animal so that it cannot bite or lick the injured part of its body.  For example, a dog with a cut on its skin might need medicine placed directly on the cut. The dog might try to lick the medicine and poison itself.  An animal that has had surgery might try to pull out its stitches .  An animal with a broken leg might bite into its cast and try to pull it off.  If it is wearing an Elizabethan collar, it cannot do this. Some pet owners say their pets find it difficult to eat, drink and play while wearing an Elizabethan collar.  Veterinarians sometimes try other collars, like those made out of cloth, collars that look like inner-tube-shaped cushions, and collars that act more like a neck brace , stopping the animal from moving its head.  Elizabethan collars are named after Elizabethan ruffs , stiff, starched collars that people wore in 1500s England. Today, most Elizabethan collars are made out of plastic .  In the 1800s, they could be made out of wood or leather. 	An Elizabethan collar , E-collar , Buster collar or pet cone  is a protective medical device worn by an animal, usually a cat or dog. Shaped like a truncated cone, its purpose is to prevent the animal from biting or licking at its body or scratching at its head or neck while wounds or injuries heal .  The collars are named from the ruffs worn in Elizabethan times .  A U.S. patent was filed by Frank L. Johnson in 1959.  The device is generally attached to the pet's usual collar with strings or tabs passed through holes punched in the sides of the plastic. The neck of the collar should be short enough to let the animal eat and drink. Although most pets adjust to them quite well, others will not eat or drink with the collar in place and the collar is temporarily removed for meals.  While purpose-made collars can be purchased from veterinarians or pet stores, they can also be made from plastic and cardboard or by using plastic flowerpots, wastebaskets, buckets or lampshades. Modern collars might involve soft fabric trim along the edges to increase comfort and velcro surfaces for ease of attachment and removal.	3.3008873
An Elizabethan collar , also called a, e-collar , lampshade or cone of shame is a piece of equipment used in veterinary medicine .  They stop the animal from licking or biting its body and from scratching or touching its head with its feet.  The veterinarian places the collar around the neck of an injured animal so that it cannot bite or lick the injured part of its body.  For example, a dog with a cut on its skin might need medicine placed directly on the cut. The dog might try to lick the medicine and poison itself.  An animal that has had surgery might try to pull out its stitches .  An animal with a broken leg might bite into its cast and try to pull it off.  If it is wearing an Elizabethan collar, it cannot do this. Some pet owners say their pets find it difficult to eat, drink and play while wearing an Elizabethan collar.  Veterinarians sometimes try other collars, like those made out of cloth, collars that look like inner-tube-shaped cushions, and collars that act more like a neck brace , stopping the animal from moving its head.  Elizabethan collars are named after Elizabethan ruffs , stiff, starched collars that people wore in 1500s England.	An Elizabethan collar , E-collar , Buster collar or pet cone  is a protective medical device worn by an animal, usually a cat or dog. Shaped like a truncated cone, its purpose is to prevent the animal from biting or licking at its body or scratching at its head or neck while wounds or injuries heal .  The collars are named from the ruffs worn in Elizabethan times .  A U.S. patent was filed by Frank L. Johnson in 1959.  The device is generally attached to the pet's usual collar with strings or tabs passed through holes punched in the sides of the plastic. The neck of the collar should be short enough to let the animal eat and drink. Although most pets adjust to them quite well, others will not eat or drink with the collar in place and the collar is temporarily removed for meals.  While purpose-made collars can be purchased from veterinarians or pet stores, they can also be made from plastic and cardboard or by using plastic flowerpots, wastebaskets, buckets or lampshades. Modern collars might involve soft fabric trim along the edges to increase comfort and velcro surfaces for ease of attachment and removal.	3.3008873
The COVID-19 pandemic was confirmed to have reached Papua New Guinea on 20 March 2020.  On 4 May, all known cases recovered.  On 20 March, the first case in Papua New Guinea was confirmed.  On 7 April, Papua New Guinea confirmed its second case of COVID-19.  On 4 May, acting Health Secretary Dr Paison Dakulala reported that all known cases have recovered, but stresses that they don't know what they are fighting. 2,400 tests have been carried out with the bulk in Port Moresby . 	The COVID-19 pandemic in Papua New Guinea is part of the worldwide pandemic of coronavirus disease 2019  caused by severe acute respiratory syndrome coronavirus 2 . The virus was confirmed to have reached Papua New Guinea on 20 March 2020.  On 4 May 2020, Papua New Guinea was declared COVID-19 free. However, on 20 June, the government confirmed another case of COVID-19, meaning that the disease was present again within the country.   Until early 2021, the country managed to stave off a major COVID-19 outbreak, with only 1,275 cases reported at the end of February according to Johns Hopkins University. In March cases tripled, with Prime Minister James Marape speaking of "rampant community transmission".  By early May, the number of hospitalizations in the capital Port Moresby stabilized, but delays in receiving test results from regional areas were a concern.  In mid May, as the reasons for the apparent easing of the pandemic situation remained uncertain, discrepancies between government figures and higher ones from the provinces led to concerns that hundreds of COVID-19 cases had been missed in the national tally. 	3.2999287
The COVID-19 pandemic was confirmed to have reached Papua New Guinea on 20 March 2020.  On 4 May, all known cases recovered.  On 20 March, the first case in Papua New Guinea was confirmed.  On 7 April, Papua New Guinea confirmed its second case of COVID-19.  On 4 May, acting Health Secretary Dr Paison Dakulala reported that all known cases have recovered, but stresses that they don't know what they are fighting. 2,400 tests have been carried out with the bulk in Port Moresby . 	The COVID-19 pandemic in Papua New Guinea is part of the worldwide pandemic of coronavirus disease 2019  caused by severe acute respiratory syndrome coronavirus 2 . The virus was confirmed to have reached Papua New Guinea on 20 March 2020.  On 4 May 2020, Papua New Guinea was declared COVID-19 free. However, on 20 June, the government confirmed another case of COVID-19, meaning that the disease was present again within the country.   Until early 2021, the country managed to stave off a major COVID-19 outbreak, with only 1,275 cases reported at the end of February according to Johns Hopkins University. In March cases tripled, with Prime Minister James Marape speaking of "rampant community transmission".  By early May, the number of hospitalizations in the capital Port Moresby stabilized, but delays in receiving test results from regional areas were a concern.  In mid May, as the reasons for the apparent easing of the pandemic situation remained uncertain, discrepancies between government figures and higher ones from the provinces led to concerns that hundreds of COVID-19 cases had been missed in the national tally. 	3.2999287
A dependent personality disorder  is a personality disorder that involves a psychological dependence on other people. This personality disorder is a long-term  condition in which people depend on others to meet their emotional and physical needs. Only a small percentage of people with dependent personality disorders are eventually able to manage on their own.	Dependent personality disorder  is a personality disorder that is characterized by a pervasive psychological dependence on other people. This personality disorder is a long-term condition  in which people depend on others to meet their emotional and physical needs, with only a minority achieving normal levels of independence. Dependent personality disorder is a Cluster C personality disorder ,  characterized by excessive fear and anxiety. It begins by early adulthood, and it is present in a variety of contexts and is associated with inadequate functioning. Symptoms can include anything from extreme passivity, devastation or helplessness when relationships end, avoidance of responsibilities and severe submission. People who have dependent personality disorder are overdependent on other people when it comes to making decisions. They cannot make a decision on their own as they need constant approval from other people. Consequently, individuals diagnosed with DPD tend to place needs and opinions of others above their own as they do not have the confidence to trust their decisions. This kind of behaviour can explain why people with DPD tend to show passive and clingy behaviour. These individuals display a fear of separation and cannot stand being alone. When alone, they experience feelings of isolation and loneliness due to their overwhelming dependence on other people. Generally people with DPD are also pessimistic: they expect the worst out of situations or believe that the worst will happen. They tend to be more introverted and are more sensitive to criticism and fear rejection.  People with a history of neglect and an abusive upbringing are more susceptible to develop DPD, specifically those involved in long-term abusive relationships. Those with overprotective or authoritarian parents are also more at risk to develop DPD. Having a family history of anxiety disorder can play a role in the development of DPD as a 2004 twin study found a 0.81 heritability for personality disorders collectively. 	3.2985373
